case_id	framework	gpus	nodes	steps_requested	decay_steps	scale_by_worker	run_status	final_step	train_total_rmse	train_energy_rmse_eV_per_atom	train_force_rmse_eV_per_A	train_virial_rmse_eV_per_atom	validation_status	validation_frames	validation_energy_rmse_eV_per_atom	validation_force_rmse_eV_per_A	validation_virial_rmse_eV_per_atom	comparison_read	production_read	source_run_dir	source_validation_root
seed02__final	TF	4	1	100000	100000	none	completed	100000	2.61	0.0417	1.42	0.0821	completed	2547	0.17574711	0.60205868	0.048237282	One of four 4GPU TF none seed repeats; reached 100k without catastrophic blowup, though the raw final training row is noisy.	Evidence so far supports 4GPU TF none as a stable default region, but this is empirical benchmark evidence rather than a theorem.	/scratch/gpfs/BURROWS/akashgpt/qmd_data/NH3_H2/sim_data_ML_v3__plumed_test__v2/v7_i34/train__test/tf_hvd_apptainer300cuda126_bench_20260422/global_batch_experiments_20260517/runs/seed_replicates_4gpu_none_100k/4gpu_100k_none_seed02	/scratch/gpfs/BURROWS/akashgpt/qmd_data/NH3_H2/sim_data_ML_v3__plumed_test__v2/v7_i34/train__test/tf_hvd_apptainer300cuda126_bench_20260422/global_batch_experiments_20260517/pseudo_validation_recent_tf_decay_seed_20260523
seed03__final	TF	4	1	100000	100000	none	completed	100000	0.79	0.00868	0.472	0.023	completed	2547	0.17467702	0.59054422	0.047426468	One of four 4GPU TF none seed repeats; reached 100k without catastrophic blowup and had stable late training behavior.	Evidence so far supports 4GPU TF none as a stable default region, but this is empirical benchmark evidence rather than a theorem.	/scratch/gpfs/BURROWS/akashgpt/qmd_data/NH3_H2/sim_data_ML_v3__plumed_test__v2/v7_i34/train__test/tf_hvd_apptainer300cuda126_bench_20260422/global_batch_experiments_20260517/runs/seed_replicates_4gpu_none_100k/4gpu_100k_none_seed03	/scratch/gpfs/BURROWS/akashgpt/qmd_data/NH3_H2/sim_data_ML_v3__plumed_test__v2/v7_i34/train__test/tf_hvd_apptainer300cuda126_bench_20260422/global_batch_experiments_20260517/pseudo_validation_recent_tf_decay_seed_20260523
seed04__final	TF	4	1	100000	100000	none	completed	100000	1.11	0.0174	0.577	0.0348	completed	2547	0.17605704	0.58735905	0.045853057	One of four 4GPU TF none seed repeats; reached 100k without catastrophic blowup and had stable late training behavior.	Evidence so far supports 4GPU TF none as a stable default region, but this is empirical benchmark evidence rather than a theorem.	/scratch/gpfs/BURROWS/akashgpt/qmd_data/NH3_H2/sim_data_ML_v3__plumed_test__v2/v7_i34/train__test/tf_hvd_apptainer300cuda126_bench_20260422/global_batch_experiments_20260517/runs/seed_replicates_4gpu_none_100k/4gpu_100k_none_seed04	/scratch/gpfs/BURROWS/akashgpt/qmd_data/NH3_H2/sim_data_ML_v3__plumed_test__v2/v7_i34/train__test/tf_hvd_apptainer300cuda126_bench_20260422/global_batch_experiments_20260517/pseudo_validation_recent_tf_decay_seed_20260523
seed05__final	TF	4	1	100000	100000	none	completed	100000	1.26	0.0535	0.334	0.00982	completed	2547	0.17305292	0.57159301	0.046051255	One of four 4GPU TF none seed repeats; reached 100k without catastrophic blowup and had stable late training behavior.	Evidence so far supports 4GPU TF none as a stable default region, but this is empirical benchmark evidence rather than a theorem.	/scratch/gpfs/BURROWS/akashgpt/qmd_data/NH3_H2/sim_data_ML_v3__plumed_test__v2/v7_i34/train__test/tf_hvd_apptainer300cuda126_bench_20260422/global_batch_experiments_20260517/runs/seed_replicates_4gpu_none_100k/4gpu_100k_none_seed05	/scratch/gpfs/BURROWS/akashgpt/qmd_data/NH3_H2/sim_data_ML_v3__plumed_test__v2/v7_i34/train__test/tf_hvd_apptainer300cuda126_bench_20260422/global_batch_experiments_20260517/pseudo_validation_recent_tf_decay_seed_20260523
8gpu_100k_none__final	TF	8	2	100000	100000	none	completed	100000	421	19.3	3.98	0.948	completed	2547	17.914549	3.3463369	0.63368278	Old 8GPU TF none 100k run blew up badly; it is the unstable reference that motivated the decay10k diagnostic.	Do not use as a production setting.	/scratch/gpfs/BURROWS/akashgpt/qmd_data/NH3_H2/sim_data_ML_v3__plumed_test__v2/v7_i34/train__test/tf_hvd_apptainer300cuda126_bench_20260422/global_batch_experiments_20260517/runs/none_100k/8gpu_100k_none	/scratch/gpfs/BURROWS/akashgpt/qmd_data/NH3_H2/sim_data_ML_v3__plumed_test__v2/v7_i34/train__test/tf_hvd_apptainer300cuda126_bench_20260422/global_batch_experiments_20260517/pseudo_validation_none_100k_final_20260521
8gpu_100k_none_decay10k__final	TF	8	2	100000	10000	none	completed	100000	1.09	0.00238	0.622	0.0355	completed	2547	0.15664999	0.45800901	0.031369228	Reducing decay_steps from 100000 to 10000 dramatically stabilized the 8GPU TF none run and removed the old catastrophic training and validation blowup.	Promising diagnostic, but not enough to move the default beyond 4GPU TF/PT.	/scratch/gpfs/BURROWS/akashgpt/qmd_data/NH3_H2/sim_data_ML_v3__plumed_test__v2/v7_i34/train__test/tf_hvd_apptainer300cuda126_bench_20260422/global_batch_experiments_20260517/runs/none_100k/8gpu_100k_none_decay10k	/scratch/gpfs/BURROWS/akashgpt/qmd_data/NH3_H2/sim_data_ML_v3__plumed_test__v2/v7_i34/train__test/tf_hvd_apptainer300cuda126_bench_20260422/global_batch_experiments_20260517/pseudo_validation_recent_tf_decay_seed_20260523
16gpu_100k_none_decay10k	TF	16	4	100000	10000	none	timed_out_blowup	77270	1.65e3	14.2	15.6	73.8	not_run	NA	NA	NA	NA	The same decay10k change did not stabilize 16GPU: it timed out at step 77270 after the training loss had already blown up.	Decay10k is not a universal fix; keep the recommended default at 4GPU TF/PT with scale_by_worker=none.	/scratch/gpfs/BURROWS/akashgpt/qmd_data/NH3_H2/sim_data_ML_v3__plumed_test__v2/v7_i34/train__test/tf_hvd_apptainer300cuda126_bench_20260422/global_batch_experiments_20260517/runs/none_100k/16gpu_100k_none_decay10k	NA
